{"$schema":"https://json-schema.org/draft/2020-12/schema","$id":"https://agentropolis.local/schemas/sovereignty/models.schema.json","type":"array","items":{"type":"object","additionalProperties":false,"required":["id","providerId","rightsId","classificationFloor","capabilities"],"properties":{"id":{"type":"string","pattern":"^[a-z0-9][a-z0-9-]*$"},"providerId":{"type":"string"},"rightsId":{"type":"string"},"classificationFloor":{"enum":["public","internal","restricted"]},"capabilities":{"type":"array","items":{"enum":["chat","tool-use","evaluation","stress-test"]},"minItems":1,"uniqueItems":true}}}}
