[{"id":"local-sovereign-chat","providerId":"local-provider","rightsId":"open-restricted-ok","classificationFloor":"restricted","capabilities":["chat","evaluation","stress-test"]},{"id":"private-sovereign-chat","providerId":"private-provider","rightsId":"open-restricted-ok","classificationFloor":"restricted","capabilities":["chat","evaluation"]},{"id":"cloud-public-chat","providerId":"cloud-provider","rightsId":"evaluation-only","classificationFloor":"public","capabilities":["chat","evaluation"]}]
